{
  "id": "video_1774843217948",
  "title": "1 Phút Hiểu CM AutoPilot - Công Nghệ AI Mới Cho Sinh Viên/Non-Tech",
  "hook": "Bạn có biết bí mật này chưa?",
  "hook_formula": "curiosity_gap",
  "language": "vi",
  "duration_target": 30,
  "format": "tiktok",
  "cta": "Lưu lại video này nhé!",
  "hashtags": [
    "#vibecoding",
    "#ai",
    "#coding"
  ],
  "scenes": [
    {
      "time_start": 0,
      "duration": 3,
      "text": "Bạn có biết bí mật này chưa?",
      "visual": "TitleCard"
    },
    {
      "time_start": 3,
      "duration": 5,
      "text": "Here is step 1.",
      "visual": "VsCodeGlow",
      "props": {
        "code": "// step 1"
      }
    },
    {
      "time_start": 8,
      "duration": 4,
      "text": "Here is step 2.",
      "visual": "DarkTerminal",
      "props": {
        "command": "run magic"
      }
    },
    {
      "time_start": 12,
      "duration": 3,
      "text": "Lưu lại video này nhé!",
      "visual": "EndCard"
    }
  ],
  "metadata": {
    "ai_generated": true,
    "ai_disclosure": "This video was fully generated by an AI pipeline."
  }
}